id,question,a1,a2,a3,a4
1,How do you prefer to spend your evenings?,At home alone,With close friends,At events and parties,Depends on my mood
2,What kind of activities excite you most?,Physical and outdoor,Creative and artistic,Social and communicative,Intellectual and educational
3,How far are you willing to travel for an event?,Within my neighbourhood,Up to 30 minutes away,Up to an hour away,Anywhere interesting
4,What time of day do you prefer events?,Early morning,Afternoon,Evening,Late night
5,How often do you attend group events?,Almost never,Once a month,A few times a month,Every week
