question,option1,option2,option3,option4
How do you prefer to spend your evenings?,Reading a book,Watching movies,Going out with friends,Playing video games
What kind of music do you enjoy most?,Pop,Rock / Metal,Electronic / DJ,Classical / Jazz
How active are you on a typical day?,Very active – gym or sport daily,Moderately active – walks,Mostly sedentary – office work,It varies a lot
What's your ideal vacation?,Beach & relaxation,City exploration,Nature & hiking,Road trip
How do you handle stressful situations?,I talk to someone,I take a walk or exercise,I distract myself,I prefer to be alone
